{"$id":"https://github.com/crieck2010/fs-exam-prep/schema/question-v1.json","$schema":"https://json-schema.org/draft/2020-12/schema","additionalProperties":false,"description":"Canonical contract for fs-exam-prep question banks. Implemented in stdlib-only Python in src/fs_quiz/contract.py; this file is the language-agnostic reference for non-Python consumers (e.g. the Flutter app).","properties":{"engine_version":{"description":"Semver of the generating engine.","type":"string"},"generator":{"description":"Producer id, e.g. 'fs-exam-prep'.","type":"string"},"question_count":{"minimum":0,"type":"integer"},"questions":{"items":{"additionalProperties":false,"properties":{"answer_index":{"maximum":3,"minimum":0,"type":"integer"},"choices":{"description":"Exactly 4 unique answer strings.","items":{"minLength":1,"type":"string"},"maxItems":4,"minItems":4,"type":"array"},"difficulty":{"description":"1 = recall/one-step, 2 = multi-step, 3 = exam-hard.","enum":[1,2,3],"type":"integer"},"domain":{"enum":["surveying-processes-and-methods","mapping-processes-and-methods","boundary-law-and-real-property","surveying-principles-geodesy","survey-computations","business-concepts-ethics","applied-math-statistics"],"type":"string"},"explanation":{"description":"Worked solution with the question's own numbers.","minLength":1,"type":"string"},"parameters":{"description":"Randomized inputs, enabling independent answer re-derivation.","type":"object"},"qid":{"description":"Stable id: sha1(generator:seed:index), 12 hex chars.","minLength":1,"type":"string"},"schema_version":{"const":1},"seed":{"type":"integer"},"stem":{"minLength":1,"type":"string"},"topic":{"minLength":1,"type":"string"}},"required":["qid","schema_version","domain","topic","difficulty","stem","choices","answer_index","explanation","parameters","seed"],"type":"object"},"type":"array"},"schema_version":{"const":1,"description":"Must equal 1 for all v1 banks."}},"required":["schema_version","generator","engine_version","question_count","questions"],"title":"fs-exam-prep question bank, schema v1","type":"object"}