{
 "engine_version": "1.0.0",
 "generator": "fs-exam-prep",
 "question_count": 96,
 "questions": [
  {
   "answer_index": 3,
   "choices": [
    "68%",
    "99.7%",
    "50%",
    "95%"
   ],
   "difficulty": 1,
   "domain": "applied-math-statistics",
   "explanation": "\u00b10.080 ft is \u00b12\u03c3. The 68\u201395\u201399.7 rule: \u00b11\u03c3 \u2192 68%, \u00b12\u03c3 \u2192 95%, \u00b13\u03c3 \u2192 99.7%.",
   "parameters": {
    "k": 2,
    "sigma": 0.0401316541090471
   },
   "qid": "c315acd5510b",
   "schema_version": 1,
   "seed": 1179079534,
   "stem": "Measurement errors are normally distributed with standard deviation \u03c3 = 0.040 ft. About what percentage of measurements fall within \u00b10.080 ft of the mean?",
   "topic": "confidence-intervals"
  },
  {
   "answer_index": 2,
   "choices": [
    "99.7%",
    "68%",
    "95%",
    "50%"
   ],
   "difficulty": 1,
   "domain": "applied-math-statistics",
   "explanation": "\u00b10.063 ft is \u00b12\u03c3. The 68\u201395\u201399.7 rule: \u00b11\u03c3 \u2192 68%, \u00b12\u03c3 \u2192 95%, \u00b13\u03c3 \u2192 99.7%.",
   "parameters": {
    "k": 2,
    "sigma": 0.03153379559485721
   },
   "qid": "c220eee64192",
   "schema_version": 1,
   "seed": 1907854250,
   "stem": "Measurement errors are normally distributed with standard deviation \u03c3 = 0.032 ft. About what percentage of measurements fall within \u00b10.063 ft of the mean?",
   "topic": "confidence-intervals"
  },
  {
   "answer_index": 3,
   "choices": [
    "299.08 ft",
    "328.92 ft",
    "19333.92 ft",
    "139.05 ft"
   ],
   "difficulty": 2,
   "domain": "applied-math-statistics",
   "explanation": "c\u00b2 = a\u00b2 + b\u00b2 \u2212 2ab\u00b7cos C = 152.27\u00b2 + 176.65\u00b2 \u2212 2(152.27)(176.65)cos(49.33\u00b0); c = 139.05 ft.",
   "parameters": {
    "C": 49.33317215245555,
    "a": 152.26572545428834,
    "b": 176.6511614707995
   },
   "qid": "ca0000bcab5c",
   "schema_version": 1,
   "seed": 1753447175,
   "stem": "In triangle ABC, side a = 152.27 ft, side b = 176.65 ft, and the included angle C = 49.33\u00b0. What is the length of side c?",
   "topic": "law-of-cosines"
  },
  {
   "answer_index": 3,
   "choices": [
    "493.89 ft",
    "541.59 ft",
    "66846.35 ft",
    "258.55 ft"
   ],
   "difficulty": 2,
   "domain": "applied-math-statistics",
   "explanation": "c\u00b2 = a\u00b2 + b\u00b2 \u2212 2ab\u00b7cos C = 336.85\u00b2 + 204.75\u00b2 \u2212 2(336.85)(204.75)cos(50.07\u00b0); c = 258.55 ft.",
   "parameters": {
    "C": 50.06716146512238,
    "a": 336.8452673816417,
    "b": 204.74763735250457
   },
   "qid": "b20aa0a2d3e7",
   "schema_version": 1,
   "seed": 1479675739,
   "stem": "In triangle ABC, side a = 336.85 ft, side b = 204.75 ft, and the included angle C = 50.07\u00b0. What is the length of side c?",
   "topic": "law-of-cosines"
  },
  {
   "answer_index": 3,
   "choices": [
    "164.17 ft",
    "82.89 ft",
    "53.38 ft",
    "251.55 ft"
   ],
   "difficulty": 2,
   "domain": "applied-math-statistics",
   "explanation": "b / sin B = a / sin A \u2192 b = 203.22 \u00d7 sin(75.25\u00b0) / sin(51.37\u00b0) = 251.55 ft.",
   "parameters": {
    "A": 51.372623286727695,
    "B": 75.24790811615054,
    "a": 203.2180385806302
   },
   "qid": "9634ff84c24c",
   "schema_version": 1,
   "seed": 574256550,
   "stem": "In triangle ABC, angle A = 51.37\u00b0, angle B = 75.25\u00b0, and side a = 203.22 ft. What is the length of side b?",
   "topic": "law-of-sines"
  },
  {
   "answer_index": 3,
   "choices": [
    "135.90 ft",
    "44.08 ft",
    "320.50 ft",
    "435.40 ft"
   ],
   "difficulty": 2,
   "domain": "applied-math-statistics",
   "explanation": "b / sin B = a / sin A \u2192 b = 373.55 \u00d7 sin(78.65\u00b0) / sin(57.27\u00b0) = 435.40 ft.",
   "parameters": {
    "A": 57.26714150432939,
    "B": 78.65477886435188,
    "a": 373.55434219661186
   },
   "qid": "854ed2713f5e",
   "schema_version": 1,
   "seed": 630629929,
   "stem": "In triangle ABC, angle A = 57.27\u00b0, angle B = 78.65\u00b0, and side a = 373.55 ft. What is the length of side b?",
   "topic": "law-of-sines"
  },
  {
   "answer_index": 2,
   "choices": [
    "5",
    "4",
    "3",
    "2"
   ],
   "difficulty": 1,
   "domain": "applied-math-statistics",
   "explanation": "In 0.0100: leading zeros are never significant; captive zeros are; trailing zeros are significant only with a decimal point. Count = 3.",
   "parameters": {
    "count": 3,
    "number": "0.0100"
   },
   "qid": "49e792f31ab8",
   "schema_version": 1,
   "seed": 210231956,
   "stem": "How many significant figures are in 0.0100?",
   "topic": "significant-figures"
  },
  {
   "answer_index": 0,
   "choices": [
    "3",
    "5",
    "4",
    "2"
   ],
   "difficulty": 1,
   "domain": "applied-math-statistics",
   "explanation": "In 0.0100: leading zeros are never significant; captive zeros are; trailing zeros are significant only with a decimal point. Count = 3.",
   "parameters": {
    "count": 3,
    "number": "0.0100"
   },
   "qid": "37bda73b0ae7",
   "schema_version": 1,
   "seed": 1762276902,
   "stem": "How many significant figures are in 0.0100?",
   "topic": "significant-figures"
  },
  {
   "answer_index": 1,
   "choices": [
    "0.1604 ft",
    "0.0178 ft",
    "0.0059 ft",
    "0.053 ft"
   ],
   "difficulty": 2,
   "domain": "applied-math-statistics",
   "explanation": "SE(mean) = s / \u221an = 0.053 / \u221a9 = 0.0178 ft. Averaging n independent measurements tightens precision by \u221an.",
   "parameters": {
    "n": 9,
    "s": 0.053450392152885245
   },
   "qid": "317e75711d1e",
   "schema_version": 1,
   "seed": 896446208,
   "stem": "Repeated measurements have a standard deviation of 0.053 ft. What is the standard error of the mean of 9 measurements?",
   "topic": "std-error-mean"
  },
  {
   "answer_index": 1,
   "choices": [
    "0.045 ft",
    "0.0090 ft",
    "0.2255 ft",
    "0.0018 ft"
   ],
   "difficulty": 2,
   "domain": "applied-math-statistics",
   "explanation": "SE(mean) = s / \u221an = 0.045 / \u221a25 = 0.0090 ft. Averaging n independent measurements tightens precision by \u221an.",
   "parameters": {
    "n": 25,
    "s": 0.04509962660139366
   },
   "qid": "485d78b16909",
   "schema_version": 1,
   "seed": 506496298,
   "stem": "Repeated measurements have a standard deviation of 0.045 ft. What is the standard error of the mean of 25 measurements?",
   "topic": "std-error-mean"
  },
  {
   "answer_index": 2,
   "choices": [
    "97.90 m",
    "454.74 m",
    "909.48 m",
    "9789.56 m"
   ],
   "difficulty": 1,
   "domain": "applied-math-statistics",
   "explanation": "2983.86 \u00d7 0.3048 = 909.48 m.",
   "parameters": {
    "ft": 2983.8583528630656,
    "kind": "ft-to-m"
   },
   "qid": "f8e5975e506c",
   "schema_version": 1,
   "seed": 1025875107,
   "stem": "A distance of 2983.86 ft is equivalent to how many meters?",
   "topic": "unit-conversions"
  },
  {
   "answer_index": 3,
   "choices": [
    "20.17 m",
    "93.70 m",
    "2017.17 m",
    "187.40 m"
   ],
   "difficulty": 1,
   "domain": "applied-math-statistics",
   "explanation": "614.83 \u00d7 0.3048 = 187.40 m.",
   "parameters": {
    "ft": 614.8327437944146,
    "kind": "ft-to-m"
   },
   "qid": "0e9862541cb8",
   "schema_version": 1,
   "seed": 902420012,
   "stem": "A distance of 614.83 ft is equivalent to how many meters?",
   "topic": "unit-conversions"
  },
  {
   "answer_index": 3,
   "choices": [
    "Yes \u2014 all five elements are satisfied",
    "No \u2014 fails the hostile claim (without permission) element",
    "No \u2014 fails the actual possession element",
    "No \u2014 fails the exclusive possession element"
   ],
   "difficulty": 3,
   "domain": "boundary-law-and-real-property",
   "explanation": "All five elements \u2014 actual, open/notorious, exclusive, hostile, continuous \u2014 must be met. The claim fails on: exclusive possession.",
   "parameters": {
    "missing_element": "exclusive possession"
   },
   "qid": "2cf926c172ce",
   "schema_version": 1,
   "seed": 47169359,
   "stem": "Ruth has shared the strip with the record owner and several neighbors throughout the 23 years, though her use was actual, open, hostile, and continuous. The statutory period is 20 years. Does Ruth's adverse possession claim succeed?",
   "topic": "adverse-possession"
  },
  {
   "answer_index": 1,
   "choices": [
    "No \u2014 fails the continuous possession for the statutory period element",
    "No \u2014 fails the actual possession element",
    "No \u2014 fails the hostile claim (without permission) element",
    "Yes \u2014 all five elements are satisfied"
   ],
   "difficulty": 3,
   "domain": "boundary-law-and-real-property",
   "explanation": "All five elements \u2014 actual, open/notorious, exclusive, hostile, continuous \u2014 must be met. The claim fails on: actual possession.",
   "parameters": {
    "missing_element": "actual possession"
   },
   "qid": "72b1436f1aed",
   "schema_version": 1,
   "seed": 501337674,
   "stem": "Ruth has never set foot on the strip; she merely asserts ownership on paper. She has been open about the claim for 23 years, excluded others, acted without permission, and never interrupted it. The statutory period is 20 years. Does Ruth's adverse possession claim succeed?",
   "topic": "adverse-possession"
  },
  {
   "answer_index": 1,
   "choices": [
    "They take as tenants in common, splitting Blackacre equally",
    "Chen prevails \u2014 Ivers had notice and is not a bona fide purchaser",
    "Chen prevails \u2014 first in time, first in right",
    "Ivers prevails \u2014 possession is nine-tenths of the law"
   ],
   "difficulty": 2,
   "domain": "boundary-law-and-real-property",
   "explanation": "Under a race-notice statute \u2014 a bona fide purchaser who records first wins: Ivers had notice and is not a bona fide purchaser, so Chen wins.",
   "parameters": {
    "act": "race-notice",
    "b_had_notice": true,
    "b_wins": false,
    "subtype": "recording-act"
   },